{"schema_version":"1.0.0","uncertainty_id":"unc_detail","question":"Should the already accepted label remain unchanged?","kind":"detail","status":"resolved","materiality":"low","reversibility":"easy","consequential":false,"downstream_dependency":false,"rationale":"The accepted record resolves it.","evidence_references":["dec_prior"]}
